{
    "$schema": "http://json-schema.org/schema#",
    "properties": {
        "appeal": {
            "type": "integer"
        },
        "effect_entries": {
            "items": {
                "properties": {
                    "effect": {
                        "type": "string"
                    },
                    "language": {
                        "properties": {
                            "name": {
                                "type": "string"
                            },
                            "url": {
                                "type": "string"
                            }
                        },
                        "required": [
                            "name",
                            "url"
                        ],
                        "type": "object"
                    }
                },
                "required": [
                    "effect",
                    "language"
                ],
                "type": "object"
            },
            "type": "array"
        },
        "flavor_text_entries": {
            "items": {
                "properties": {
                    "flavor_text": {
                        "type": "string"
                    },
                    "language": {
                        "properties": {
                            "name": {
                                "type": "string"
                            },
                            "url": {
                                "type": "string"
                            }
                        },
                        "required": [
                            "name",
                            "url"
                        ],
                        "type": "object"
                    }
                },
                "required": [
                    "flavor_text",
                    "language"
                ],
                "type": "object"
            },
            "type": "array"
        },
        "id": {
            "type": "integer"
        },
        "jam": {
            "type": "integer"
        }
    },
    "required": [
        "appeal",
        "effect_entries",
        "flavor_text_entries",
        "id",
        "jam"
    ],
    "type": "object"
}