{
    "appeal": 3,
    "effect_entries": [
        {
            "effect": "User will go first next turn.",
            "language": {
                "name": "en",
                "url": "http://127.0.0.1:8000/api/v2/language/9/"
            }
        }
    ],
    "flavor_text_entries": [
        {
            "flavor_text": "The next appeal can be made earlier next turn.",
            "language": {
                "name": "en",
                "url": "http://127.0.0.1:8000/api/v2/language/9/"
            }
        }
    ],
    "id": 30,
    "jam": 0
}
