{"effect_entries":[{"effect":"Randomly earns one, two, four, or eight points.","language":{"url":"http:\/\/127.0.0.1:8000\/api\/v2\/language\/9\/","name":"en"}}],"jam":0,"appeal":1,"flavor_text_entries":[{"flavor_text":"The appeal's quality depends on its timing.","language":{"url":"http:\/\/127.0.0.1:8000\/api\/v2\/language\/9\/","name":"en"}}],"id":25}
