{"effect_entries":[{"effect":"User will go last next turn.","language":{"url":"http:\/\/127.0.0.1:8000\/api\/v2\/language\/9\/","name":"en"}}],"jam":0,"appeal":3,"flavor_text_entries":[{"flavor_text":"The next appeal can be made later next turn.","language":{"url":"http:\/\/127.0.0.1:8000\/api\/v2\/language\/9\/","name":"en"}}],"id":31}
